{
  "schemaVersion": 1,
  "generatedAt": "2026-09-07T11:00:35.372Z",
  "scanHash": "3a7e40f764249f1811dd11df9ec05b74672aba4dfbcd6c448ea04fe46a0b43fc",
  "articles": [
    {
      "id": "investment-psychology",
      "status": "selected",
      "reason": "Both Markdown and rendered HTML are image-free",
      "summary": {
        "zh": "投资心理学；这种机制在下跌的时候同样成立，所有人都在卖，所以价格下跌；价格下跌又证明风险很大，于是更多人卖。人群既可以制造狂热，也可以制造恐慌，而站在人群里面的人通常不会觉得自己正在从众，他会觉得自己只是做出了独立判断。",
        "en": "There is something strange about investing. If an item in a supermarket drops from 100 yuan to 70, most people see it as cheaper and become more willing to buy, as long as the product itself has not changed. Financial markets often work in exactly the opposite"
      },
      "contentHash": "ed62652849a06a5d0ca388cfda229d1468ae76320445023969b7f3136b6a3764",
      "languages": {
        "zh": {
          "file": "article/关于投资的心理学.md",
          "title": "关于投资的心理学",
          "contentHash": "8bf78b042b0ec8f0d718e706d1124d4d360ce27d7b68ff962c5e2e59030c23ba"
        },
        "en": {
          "file": "article/The Psychology of Investing.md",
          "title": "The Psychology of Investing",
          "contentHash": "c3bc40aac47f1829d2bf08776b810aea828d6b1898566e09ae46f7823962bf4c"
        }
      }
    },
    {
      "id": "scarce-skills",
      "status": "selected",
      "reason": "Both Markdown and rendered HTML are image-free",
      "summary": {
        "zh": "最近找工作的时候，我越来越强烈地意识到一个问题：这个社会上会做事情的人其实已经太多了。打开招聘软件，随便找一个稍微正常一点的岗位，几百个人投简历已经不是什么稀奇的事情，一个刚毕业的大学生会用Office，会剪视频，会做PPT，会一点Python、Java，英语过了四六级，还能用ChatGPT帮自己写代码，把时间往前推十几年，这种人可能算是一个能力不错的大学生，现在却只是一个极其普通的毕业生。；还有一种我觉得经常被低估的稀缺，是技能之间的组合。",
        "en": "While looking for work recently, one fact has become harder and harder to ignore: people who know how to do useful work are no longer scarce. Open a job app and pick any half-decent position, and hundreds of applications are no longer unusual. A new graduate c"
      },
      "contentHash": "50fa304ce8b57bf301ea615cb6b50c2897d2e6631790267a21eb7784003f87b4",
      "languages": {
        "zh": {
          "file": "article/什么是稀缺的技能.md",
          "title": "什么是稀缺的技能",
          "contentHash": "8b039e806a532a31336b6a3e531c4def1e164c266f207ae5ccbddd8abace86d7"
        },
        "en": {
          "file": "article/What Makes a Skill Scarce.md",
          "title": "What Makes a Skill Scarce?",
          "contentHash": "c3819de95d037c819cc72c78f84d3ca5c6ce3df223abfd8cbd61939894ca9f6b"
        }
      }
    },
    {
      "id": "what-is-bitcoin",
      "status": "selected",
      "reason": "Both Markdown and rendered HTML are image-free",
      "summary": {
        "zh": "比特币这个东西似乎很神秘。虽然价格已经达到几万美元一颗了，并且很多机构和投资者都知道它，但是了解它原理的人却很少。大部分人对它为什么这么贵还是一头雾水，甚至觉得它被发明出来就是为了诈骗和庞氏骗局。我个人认为它是由众多平等的员工创造出的一个乌托邦公司，提供了一种独一无二的货币，并且是全新的储蓄方式，通过我写的这篇文章，我相信即使是一个新手也能理解比特币到底是个什么东西。；其实历史上比较大的更新一只手都数的过来，2015年左右的隔离见证、2016的闪电网络、还有2017的比特现金（Bitcoin Cash，简称BCH）",
        "en": "Bitcoin can seem mysterious. One bitcoin is already worth tens of thousands of dollars, and it is familiar to many institutions and investors, yet very few people understand how it actually works. Most people are still puzzled by why it costs so much. Some eve"
      },
      "contentHash": "81eb5d9129bb5cde1cd7045263c3216cebea4f0aa1ea32f07c5cd9c6883c3ef0",
      "languages": {
        "zh": {
          "file": "article/什么是比特币.md",
          "title": "什么是比特币？",
          "contentHash": "eb55c1c29e8ce0d5af4e9dfbc2223c284035461e9131e81a3077193587f1beea"
        },
        "en": {
          "file": "article/What Is Bitcoin.md",
          "title": "What Is Bitcoin?",
          "contentHash": "153dc9bab73c4b310f06774c2a2fe5383b49696062ea55fb015a07ae95b47521"
        }
      }
    },
    {
      "id": "focus-experiment",
      "status": "skipped",
      "reason": "At least one source already contains an image",
      "summary": {
        "zh": "摘要：我记录了 7 次雅思听力与阅读训练，其中 4 次服用茶氨酸与咖啡因组合，3 次未服用。最后一次是真实考试的场景。服用组的听力、阅读均分分别比未服用组高 0.54 和 0.75 分，两科合并均分高 0.65 分。这个结果说明组合的使用与更高成绩同时出现，但由于样本只有 1 人，且没有随机、盲法和安慰剂控制，不能证明它直接提高了雅思成绩。；7 次记录中，服用组的两科均值均高于未服用组。阅读的差异更明显，听力的波动相对较小。图中也保留了每次测试的原始分数，避免只看均值而忽略单次差异。",
        "en": "Abstract: I recorded seven IELTS listening and reading sessions. I took a combination of L-theanine and caffeine for four of them and took neither for the other three. The final entry came from the real exam. Average listening and reading scores in the combina"
      },
      "contentHash": "4717eabe3168b9224690dcb5a667b511b094118b182c018619d5485bd2e0dec8",
      "languages": {
        "zh": {
          "file": "article/邪修提升专注力.md",
          "title": "邪修提升专注力：茶氨酸与咖啡因在雅思场景中的个人观察",
          "contentHash": "504b65ec4292f4bf079ac5678bf70d04565ec02439cf47cc0e5d08bc24bbc337"
        },
        "en": {
          "file": "article/An Unorthodox Focus Hack.md",
          "title": "An Unorthodox Focus Hack: Personal Observations on L-Theanine and Caffeine for IELTS",
          "contentHash": "2eb20fddc0f50e980606dce2be69f10e0559b332f251e79fec965224b59d676a"
        }
      }
    },
    {
      "id": "ielts-guide",
      "status": "selected",
      "reason": "Both Markdown and rendered HTML are image-free",
      "summary": {
        "zh": "我自学雅思首考7.0，总花费0元。本文保留了我的备考经验、资源推荐和分数参考。相关观点并非官方标准，网站可用性与题库时效性也未作额外核验。；免费课程推荐：B 站 UP 主“Larry 想做技术大佬”的课程《半个月搭建你的语法体系》。",
        "en": "I taught myself IELTS and scored 7.0 on my first attempt, spending nothing in total. This guide collects the study methods, resources, and score references I used. The views here are not official standards, and I have not independently checked whether every we"
      },
      "contentHash": "6f902f414160834a483f331e47a778a0306761d1b4b4683d69965f576e77ad75",
      "languages": {
        "zh": {
          "file": "article/平民雅思备考指南.md",
          "title": "平民雅思备考指南：0 成本学雅思教程",
          "contentHash": "c4123bd7c744ae1c8b94f0c86b53a918d064b41ab9638ce218e040546e951c28"
        },
        "en": {
          "file": "article/IELTS on a Budget.md",
          "title": "IELTS on a Budget: A Zero-Cost Self-Study Guide",
          "contentHash": "97f6030bf98a104457515595b06eafeb5cbe26cb6c7e2ce8b17abb22fce68560"
        }
      }
    }
  ],
  "candidates": [
    {
      "imageId": "investment-feedback-loop",
      "articleId": "investment-psychology",
      "languageStrategy": "localized-svg",
      "anchors": {
        "zh": {
          "kind": "paragraph",
          "match": "很多时候，事实根本没有发生变化，变化的只是价格，而价格改变情绪，情绪重新筛选信息，最后这些被筛选出来的信息又反过来证明自己的情绪是正确的，于是形成一个很难察觉的循环。人通常以为",
          "placement": "after",
          "occurrence": 1,
          "contextHash": "bd5a89d62f60c184e951c580076c6f95be960017aac57f308b352c5948aea1ad"
        },
        "en": {
          "kind": "paragraph",
          "match": "Often, the facts have not changed at all. Only the price has changed. The price changes",
          "placement": "after",
          "occurrence": 1,
          "contextHash": "113656228c6d073808effc6847256363278d86280a3efbbf2df79af88383d011"
        }
      },
      "visualRole": "Expose the self-reinforcing decision loop described in the surrounding paragraph",
      "mediaType": "svg",
      "subject": {
        "zh": "价格、情绪、选择性证据与行动之间的反馈回路",
        "en": "The feedback loop between price, emotion, selective evidence, and action"
      },
      "composition": "Four labeled nodes arranged clockwise around an open center, joined by directional arrows and one restrained accent link",
      "style": "Warm-white editorial paper, near-black ink, restrained clay-orange accent, flat two-dimensional geometry, fine rules, generous negative space, no gradients",
      "aspectRatio": "16:9",
      "prompt": "Render a deterministic editorial diagram of the investment feedback loop: price movement changes emotion, emotion filters evidence, selected evidence drives action, and action reinforces price. Use localized labels from the renderer.",
      "negativeConstraints": [
        "no gradient",
        "no 3D corporate illustration",
        "no embedded words or letters",
        "no watermark or logo",
        "no photorealistic human face",
        "no decorative clutter"
      ],
      "alt": {
        "zh": "价格变化、情绪、选择性证据和投资行动相互强化的循环图",
        "en": "A loop showing price movement, emotion, selective evidence, and investor action reinforcing one another"
      },
      "caption": {
        "zh": "图：价格先改变情绪，情绪再筛选证据，行动最终把判断推回市场。",
        "en": "Figure: Price changes emotion, emotion filters evidence, and action feeds the judgment back into the market."
      },
      "confidence": 0.99,
      "scores": {
        "semanticFit": 1,
        "explanatoryValue": 0.97,
        "placement": 0.94,
        "novelty": 0.96,
        "total": 0.98
      },
      "rationale": "Selected because the nearby passage is structurally visual and scored 0.98 after semantic, explanatory, placement, and novelty checks.",
      "critique": "A diagram explains the relationship more precisely than decorative imagery; localized labels prevent translation loss.",
      "contentHash": "f54fb4b16bff8f258f654db0ae38d12c93a29f09679849b58b4bfdf5ef47ca10",
      "assets": {
        "zh": {
          "sourcePath": "tools/blog-image-agent/generated/source/investment-feedback-loop-zh.svg",
          "webPath": "assets/blog/investment-feedback-loop-zh.svg",
          "width": 1200,
          "height": 675,
          "format": "svg",
          "sha256": "5abf2af20c225b174748c91d5203bf7338cc186e5aa8f5a0ce143f0bb926041a"
        },
        "en": {
          "sourcePath": "tools/blog-image-agent/generated/source/investment-feedback-loop-en.svg",
          "webPath": "assets/blog/investment-feedback-loop-en.svg",
          "width": 1200,
          "height": 675,
          "format": "svg",
          "sha256": "65bd7f9d94d1d4576829cb2fdbcf79ed8dba180ad75af1a90aa4b5f5c50c191e"
        }
      }
    },
    {
      "imageId": "investment-high-wire",
      "articleId": "investment-psychology",
      "languageStrategy": "shared-raster",
      "anchors": {